{
  "created_at": "2026-04-22T00:00:00Z",
  "evidence_refs": [
    "generated/multi_office_train_clean_flow/release_train.json"
  ],
  "forced_adoption": false,
  "id": "multi_office_train_precedent_v1_example",
  "kind": "multi_office_train_precedent_v1",
  "notes": "Example artifact for multi_office_train_precedent_v1.",
  "owner_repo": "aoa-kag",
  "precedent": "first_service_mesh_release",
  "status": "draft",
  "version": "1.1.0"
}